[
  {"id":"BG_2_47","tradition":"gita","book":null,"kanda":null,"chapter":2,"sarga":null,"item_number":47,"canonical_reference":"BG 2:47","source_text":"कर्मण्येवाधिकारस्ते मा फलेषु कदाचन।","transliteration":"karmaṇy-evādhikāras te mā phaleṣu kadācana","translation":"You have a right to your actions, but never to their fruits.","translator":"project-team (verify vs critical ed.)","edition":"draft-1.0","license":"CC0-1.0 (translation; verse public domain)","source_url":null,"keywords":["duty","action","detachment"]},
  {"id":"RAM_AYO_18_15","tradition":"ramayana","book":null,"kanda":"Ayodhya","chapter":2,"sarga":18,"item_number":15,"canonical_reference":"Ramayana 2.18.15","source_text":"रामो द्विर्नाभिभाषते।","transliteration":"rāmo dvir nābhibhāṣate","translation":"Rama does not speak twice (he keeps his word).","translator":"project-team (verify vs critical ed.)","edition":"draft-1.0","license":"CC0-1.0 (translation; text public domain)","source_url":null,"keywords":["dharma","promise","filial"]},
  {"id":"DHP_001","tradition":"dhammapada","book":null,"kanda":null,"chapter":1,"sarga":null,"item_number":1,"canonical_reference":"Dhp 1","source_text":"Manopubbaṅgamā dhammā, manoseṭṭhā manomayā","transliteration":"Manopubbaṅgamā dhammā, manoseṭṭhā manomayā","translation":"Mind precedes all phenomena, mind is their chief.","translator":"F. Max Muller (SBE Vol.X, public domain)","edition":"SBE-X-1881","license":"Public Domain","source_url":null,"keywords":["mind","causality","intention"]},
  {"id":"BIBLE_PROV_3_5","tradition":"bible","book":"Proverbs","kanda":null,"chapter":3,"sarga":null,"item_number":5,"canonical_reference":"Proverbs 3:5 [WEB]","source_text":"Trust in Yahweh with all your heart, and don't lean on your own understanding.","transliteration":null,"translation":"Trust in Yahweh with all your heart, and don't lean on your own understanding.","translator":"World English Bible","edition":"WEB","license":"Public Domain","source_url":null,"keywords":["trust","wisdom","faith"]},
  {"id":"QUR_2_255","tradition":"quran","book":null,"kanda":null,"chapter":2,"sarga":null,"item_number":255,"canonical_reference":"Surah 2:255","source_text":"اللَّهُ لَا إِلَٰهَ إِلَّا هُوَ الْحَيُّ الْقَيُّومُ","transliteration":"Allāhu lā ilāha illā huwa al-ḥayyu al-qayyūm","translation":"Allah! There is no god but He, the Living, the Self-subsisting.","translator":"M. Pickthall (1930, public domain)","edition":"Pickthall-1930","license":"Public Domain (translation)","source_url":null,"keywords":["sovereignty","throne-verse","tawhid"]}
]
